Movie,Year,Genres,Certification/Rating,IMDb ID,Writer,Director,Actors,Plot,Country,IMDb Rating,Runtime
Aakrosh,2010,"Action, Crime, Drama",Not Rated,tt1708453,Robin Bhatt,Priyadarshan,"Ajay Devgn, Akshaye Khanna, Bipasha Basu","The Central Bureau of Investigation deputes two officers to investigate the disappearance of three medical students, which they believe to be an incident of 'honour killing' in a small, closed community.",India,7,146 min
Ready,2011,"Action, Comedy, Romance",Not Rated,tt1708532,Rajan Agarwal,Anees Bazmee,"Salman Khan, Asin Thottumkal, Paresh Rawal","Set in Thailand and India, a case of mistaken identity leads to love, and a man and his family concoct a grand scheme to win over the hearts of a woman and her greedy, conniving uncles.",India,4.8,145 min
Byomkesh Bakshi,2010,"Drama, Mystery, Thriller",N/A,tt1723596,Saradindu Bandopadhyay,Anjan Dutt,"Abir Chatterjee, Saswata Chatterjee, Arindol Bagchi",Byomkesh Bakshi is a Bengali detective who is called on for a spine-chilling case with his assistant/friend Ajit.,India,7.4,136 min
Mere Brother Ki Dulhan,2011,"Comedy, Drama, Family",Not Rated,tt1740710,Ali Abbas Zafar,Ali Abbas Zafar,"Imran Khan, Katrina Kaif, Ali Zafar",A quirky rom-com where Kush finds the ideal Indian bride Dimple for his brother Luv and a series of comical and unpredictable events follow.,India,5.9,139 min
Ship of Theseus,2012,Drama,Not Rated,tt1773764,Anand Gandhi,Anand Gandhi,"Aydah El-Kashef, Yogesh Shah, Faraz Khan","The film explores questions of identity, justice, beauty, meaning and death through an experimental photographer, an ailing monk and a young stockbroker.","India, Netherlands",8,140 min
Talaash: The Answer Lies Within,2012,"Crime, Drama, Mystery",Not Rated,tt1787988,Farhan Akhtar,"Reema Kagti, Priyamvada Narayanan","Aamir Khan, Kareena Kapoor, Rani Mukerji","Inspector Surjan Shekhawat, who is dealing with a depressing past, has to investigate a high profile murder case, deal with his crumbling marriage and use the help and solace of a prostitute by the name of Rosie.",India,7.2,140 min
I Am Kalam,2010,"Comedy, Drama, Family",Not Rated,tt1805263,Sanjay Chauhan,Nila Madhab Panda,"Gulshan Grover, Harsh Mayar, Pitobash",An impoverished boy forms an unlikely and unstable friendship with the lonely son of a nobleman.,India,8,88 min
Moner Manush,2010,Biography,N/A,tt1815837,Shahzad Firdaus,Goutam Ghose,"Prasenjit Chatterjee, Shahed Ali, Raisul Islam Asad",The movie is about a poet and singer Lalon Fakir who belongs to a cult called baul and who believes and inculcates that the value of a human being is above the narrow belief of religions.,"India, Bangladesh",7.9,150 min
Ernest & Celestine,2012,"Animation, Adventure, Comedy",PG,tt1816518,Daniel Pennac,"St√©phane Aubier, Vincent Patar, Benjamin Renner","Lambert Wilson, Pauline Brunner, Anne-Marie Loop","The story of an unlikely friendship between a bear, Ernest, and a young mouse named Celestine.","France, Belgium, Luxembourg",7.8,80 min
Kahaani,2012,"Mystery, Thriller",Not Rated,tt1821480,Sujoy Ghosh,Sujoy Ghosh,"Vidya Balan, Parambrata Chattopadhyay, Indraneil Sengupta","A pregnant woman's search for her missing husband takes her from London to Kolkata, but everyone she questions denies having ever met him.",India,8.1,122 min
Dhoom 3,2013,"Action, Crime, Drama",Not Rated,tt1833673,Vijay Krishna Acharya,Vijay Krishna Acharya,"Aamir Khan, Katrina Kaif, Abhishek Bachchan","Jai and Ali return to catch the clown thief, Sahir, who has the City of Chicago captive. Watch an unconventional battle of revenge that will thrill you.","India, United States",5.4,172 min
Children's Party,2011,"Comedy, Drama, Family",Not Rated,tt1841542,Vikas Bahl,"Vikas Bahl, Nitesh Tiwari","Irfan Khan, Sanath Menon, Rohan Grover",A gang of innocent but feisty kids who lead carefree lives in Chandan Nagar colony takes on the big bad world of politics when one of their friend's life is endangered.,India,7.5,135 min
Necklace,2011,Thriller,N/A,tt1843994,Shekhar Das,Shekhar Das,"Rituparna Sengupta, Locket Chatterjee, Ritwick Chakraborty",Two couples belonging to different social strata get intertwined by coincidences and face different crises on the same day. The corporate executive and his wife face an unforeseen bewildering situation when they confront a burglar...,India,5.8,110 min
Aarakshan,2011,"Drama, Thriller",N/A,tt1848771,Prakash Jha,Prakash Jha,"Amitabh Bachchan, Saif Ali Khan, Manoj Bajpayee",The decision by India's supreme court to establish caste-based reservations for jobs in education causes conflict between a teacher and his mentor.,India,6.2,164 min
Agneepath,2012,"Action, Crime, Drama",Not Rated,tt1849718,Ila Bedi Dutta,Karan Malhotra,"Hrithik Roshan, Priyanka Chopra Jonas, Sanjay Dutt",A young boy's father is lynched before his eyes; fifteen years later he returns home for revenge.,India,6.9,174 min
Kodachrome,2017,Drama,TV-MA,tt1880399,Jonathan Tropper,Mark Raso,"Ed Harris, Jason Sudeikis, Elizabeth Olsen","Set during the final days of the admired photo development system known as Kodachrome, a father and son hit the road in order to reach the Kansas photo lab before it closes its doors for good.","Canada, United States",6.8,105 min
Once Upon a Time in Mumbaai Dobara,2013,"Action, Crime, Drama",Not Rated,tt1891884,Rajat Arora,Milan Luthria,"Akshay Kumar, Imran Khan, Sonakshi Sinha","After killing his mentor, a gangster comes into power to rule over Mumbai. In the process he falls for an aspiring actress, nevertheless he finds that his protege has fallen for her too which leads to enmity between them.",India,4.4,160 min
Stanley Ka Dabba,2011,"Comedy, Drama, Family",Not Rated,tt1907761,Amole Gupte,Amole Gupte,"Partho A. Gupte, Numaan Sheikh, Abhishek Reddy","A school-teacher, who forces children to share their food with him, forbids one from entering the school until he brings his own Tiffin/Lunch-box.",India,7.8,96 min
Shor in the City,2010,"Crime, Drama",N/A,tt1916728,Krishna D.K.,"Krishna D.K., Raj Nidimoru","Tusshar Kapoor, Sendhil Ramamurthy, Nikhil Dwivedi",Various residents and career-criminals face challenges in crime-laden Mumbai.,India,7.2,112 min
Murder 2,2011,"Action, Crime, Drama",Not Rated,tt1918965,Mahesh Bhatt,Mohit Suri,"Emraan Hashmi, Jacqueline Fernandez, Prashant Narayanan",An ex-cop is hired by a pimp to find missing call girls and the man responsible behind their abduction.,India,6.3,127 min
Pyaar Ka Punchnama,2011,"Comedy, Drama, Romance",Not Rated,tt1926313,Luv Ranjan,Luv Ranjan,"Kartik Aaryan, Ashish Chhipa, Raayo S. Bakhirta",Nishant starts dating Charu while his roommates Rajat and Vikrant already have girlfriends in Neha and Rhea respectively. Trouble starts when the guys feel that their girlfriends are dominating them.,India,7.6,149 min
Heaven Is for Real,2014,"Biography, Drama, Family",PG,tt1929263,Randall Wallace,Randall Wallace,"Greg Kinnear, Kelly Reilly, Thomas Haden Church","A small-town father must find the courage and conviction to share his son's extraordinary, life-changing experience with the world.",United States,5.8,99 min
Delhi Belly,2011,"Action, Comedy, Crime",Not Rated,tt1934231,Mr. Moris,"Abhinay Deo, Akshat Verma","Imran Khan, Vir Das, Kunaal Roy Kapur",Three struggling room-mates unknowingly become potential prey of a ruthless gangster.,India,7.5,103 min
Bheja Fry 2,2011,"Comedy, Drama",Not Rated,tt1939654,Sagar Ballary,Sagar Ballary,"Vinay Pathak, Kay Kay Menon, Minissha Lamba",A tax-evading businessman and an income-tax officer get stranded on an isolated island.,India,4.7,129 min
Noukadubi,2011,"Drama, Romance",N/A,tt1946280,Rituparno Ghosh,Rituparno Ghosh,"Jisshu Sengupta, Riya Sen, Raima Sen","Months after an accident following his marriage, a husband finds that the veiled woman he brought home is not his wife.",India,7.7,135 min
Singham,2011,"Action, Crime, Drama",Not Rated,tt1948150,Hari,Rohit Shetty,"Ajay Devgn, Prakash Raj, Sudhanshu Pandey",A truly honest police officer is transferred to a town controlled by a gangster he has humiliated. The gangster believes he can use good power to bring down this officer who made him look foolish and weak.,India,6.8,143 min
Heroine,2012,Drama,Not Rated,tt1949548,Madhur Bhandarkar,Madhur Bhandarkar,"Kareena Kapoor, Arjun Rampal, Randeep Hooda",A female superstar struggles through the trials and tribulations of being a Bollywood actress.,India,5,149 min
Gangs of Wasseypur,2012,"Action, Comedy, Crime",Not Rated,tt1954470,Akhilesh Jaiswal,Anurag Kashyap,"Manoj Bajpayee, Nawazuddin Siddiqui, Tigmanshu Dhulia","A clash between Sultan and Shahid Khan leads to the expulsion of Khan from Wasseypur, and ignites a deadly blood feud spanning three generations.",India,8.2,321 min
Tomorrowland,2015,"Action, Adventure, Family",PG,tt1964418,Damon Lindelof,Brad Bird,"George Clooney, Britt Robertson, Hugh Laurie","Bound by a shared destiny, a teen bursting with scientific curiosity and a former boy-genius inventor embark on a mission to unearth the secrets of a place somewhere in time and space that exists in their collective memory.","United States, Spain, France, Canada, United Kingdom",6.4,130 min
The Angry Birds Movie,2016,"Animation, Action, Adventure",PG,tt1985949,Jon Vitti,"Clay Kaytis, Fergal Reilly","Jason Sudeikis, Josh Gad, Danny McBride","When an island populated by happy, flightless birds is visited by mysterious green piggies, it's up to three unlikely outcasts - Red, Chuck and Bomb - to figure out what the pigs are up to.","Finland, United States",6.3,97 min
Chaplin,2011,Drama,N/A,tt2040306,Anindya Bandopadhyay,Anindya Bandopadhyay,"Rudranil Ghosh, Soham Maitra, Srijit Mukherji","Bangshi Das is an impersonator of Charlie Chaplin. He earns peanuts by being the 'joker' at birthday parties. However, he prefers to call himself an actor rather than a worker. His life circles around his son who is the greatest c...",India,7.5,123 min
22 Shey Shraban,2011,"Action, Crime, Drama",Not Rated,tt2075108,Annapurna Basu,Srijit Mukherji,"Prasenjit Chatterjee, Parambrata Chattopadhyay, Raima Sen",An ex-cop is hired to track down a serial killer who carries out his killings according to Bengali poetry.,India,8.1,139 min
Barfi!,2012,"Comedy, Drama, Romance",Not Rated,tt2082197,Anurag Basu,Anurag Basu,"Ranbir Kapoor, Priyanka Chopra Jonas, Ileana D'Cruz",Three young people learn that love can neither be defined nor contained by society's definition of normal and abnormal.,India,8.1,151 min
Inside Out,2015,"Animation, Adventure, Comedy",PG,tt2096673,Pete Docter,"Pete Docter, Ronnie Del Carmen","Amy Poehler, Bill Hader, Lewis Black","After young Riley is uprooted from her Midwest life and moved to San Francisco, her emotions - Joy, Fear, Anger, Disgust, and Sadness - conflict on how best to navigate a new city, house, and school.","United States, Japan",8.1,95 min
"McFarland, USA",2015,"Biography, Drama, Sport",PG,tt2097298,Christopher Cleveland,Niki Caro,"Kevin Costner, Maria Bello, Ramiro Rodriguez","Jim White moves his family after losing his last job as a football coach, and at his new school he turns seven disappointing students into one of the best cross-country teams in the region.",United States,7.4,129 min
Matru Ki Bijlee Ka Mandola,2013,"Comedy, Drama",Not Rated,tt2106537,Vishal Bhardwaj,Vishal Bhardwaj,"Pankaj Kapur, Imran Khan, Anushka Sharma","Harry is an industrialist who loves his daughter Bijlee, and the bond they share with Harry's man friday, Matru. Bijlee's plan to wed the son of a politician, however, brings twists and turns in the lives of Matru, Bijlee and Mand...",India,5.6,151 min
Chennai Express,2013,"Action, Comedy, Drama",Not Rated,tt2112124,K. Subhash,Rohit Shetty,"Deepika Padukone, Shah Rukh Khan, Sathyaraj",A man travelling to Rameshwaram via Chennai express in order to immerse his late grandfather's ashes finds himself in trouble after helping a don's daughter and her cousins board the train.,India,6.1,141 min
Ferrari Ki Sawaari,2012,"Comedy, Drama, Family",Not Rated,tt2122340,Vidhu Vinod Chopra,Rajesh Mapuskar,"Sharman Joshi, Boman Irani, Ritvik Sahore",How the pursuit of an Indian cricket legend's Ferrari makes a young boy's dreams of playing cricket at Lords a reality.,India,6.4,140 min
Royal Bengal Rahasya,2011,"Adventure, Thriller",Not Rated,tt2133312,Sandip Ray,Sandip Ray,"Sabyasachi Chakrabarty, Saheb Bhattacharjee, Bibhu Bhattacharya","Feluda and his gang gets invited to North Bengal by a wealthy Zamindar to solve a piece of a puzzle supposedly leading to buried ""treasure"", but things take a turn for the unexpected with a mysterious death and rumors about a man-...",India,7.3,106 min
Gorosthane Sabdhan,2010,"Crime, Mystery",N/A,tt2136956,Sandip Ray,Sandip Ray,"Sabyasachi Chakrabarty, Saheb Bhattacharjee, Bibhu Bhattacharya","A sudden violent storm takes Kolkata by sutprise. It also Narendra Nath Biswas injured, hit by a falling tree in the Park Street Cemetery. ... or was it the work of some unknown assailant? Feluda investigates and soon encounters e...",India,6.9,100 min
Rock on 2,2016,"Drama, Music",Not Rated,tt2137241,Abhishek Kapoor,Shujaat Saudagar,"Farhan Akhtar, Shraddha Kapoor, Arjun Rampal","The band, Magik reunites with some new members.",India,4.9,143 min
Cocktail,2012,"Comedy, Drama, Romance",Not Rated,tt2168910,Imtiaz Ali,Homi Adajania,"Saif Ali Khan, Deepika Padukone, Diana Penty","A love triangle between a guy and two girls, who are best friends but the complete opposite of one another.","United Kingdom, India",6.3,146 min
Jab Tak Hai Jaan,2012,"Drama, Romance",Not Rated,tt2176013,Aditya Chopra,Yash Chopra,"Shah Rukh Khan, Katrina Kaif, Anushka Sharma",An uncompromising film on true love from the legendary and unforgettable director Yash Chopra which is fascinatingly distinctive and contemporary.,India,6.7,176 min
Yeh Jawaani Hai Deewani,2013,"Comedy, Drama, Musical",Not Rated,tt2178470,Hussain Dalal,Ayan Mukerji,"Ranbir Kapoor, Deepika Padukone, Aditya Roy Kapoor","Kabir and Naina bond during a trekking trip. Before Naina can express herself, Kabir leaves India to pursue his career. They meet again years later, but he still cherishes his dreams more than bonds.",India,7.2,160 min
Shahid,2012,"Biography, Drama",Not Rated,tt2181831,Sameer Gautam Singh,Hansal Mehta,"Rajkummar Rao, Prabhleen Sandhu, Mohd. Zeeshan Ayyub","The account of Human Rights lawyer Shahid Azmi, an ordinary citizen with an extraordinary commitment to justice.",India,8.2,129 min
English Vinglish,2012,"Comedy, Drama, Family",Not Rated,tt2181931,Gauri Shinde,Gauri Shinde,"Sridevi, Adil Hussain, Mehdi Nebbou","A quiet, sweet tempered housewife endures small slights from her well-educated husband and daughter every day because of her inability to speak and understand English.",India,7.8,134 min
Vishwaroopam,2013,"Action, Thriller",Not Rated,tt2199711,H. Banerjee,Kamal Haasan,"Pooja Kumar, Miles Anderson, Kamal Haasan","When a classical dancer's suspecting wife sets an investigator behind him, a series of violent events are triggered, revealing his real identity and connection to a darker world.",India,7.9,148 min
Aashiqui 2,2013,"Drama, Music, Musical",Not Rated,tt2203308,Shagufta Rafique,Mohit Suri,"Aditya Roy Kapoor, Shraddha Kapoor, Shaad Randhawa",Rahul loses his fans and fame due to alcoholism. But he then decides to turn a small time singer into a rising star.,India,7,132 min
RamLeela,2013,"Drama, Musical, Romance",Not Rated,tt2215477,Sanjay Leela Bhansali,Sanjay Leela Bhansali,"Ranveer Singh, Deepika Padukone, Supriya Pathak","Modern adaptation of William Shakespeare's 'Romeo and Juliet' with an Indian twist, the film focuses on the story of Ram and Leela, their love, lust and the drama afterwards.",India,6.4,150 min
Robber,2013,"Drama, Romance",Not Rated,tt2224317,O. Henry,Vikramaditya Motwane,"Ranveer Singh, Sonakshi Sinha, Barun Chanda","An aristocrat's daughter falls in love with a visiting archaeologist, but he holds a secret that could drive them apart.",India,7.4,136 min
Jism 2,2012,"Drama, Romance, Thriller",N/A,tt2226666,Mahesh Bhatt,Pooja Bhatt,"Randeep Hooda, Arunoday Singh, Arif Zakaria","Izna, a porn star, is tasked by an Indian Intelligence Agency to seduce her ex-boyfriend Kabir, a dreaded assassin, in order to steal vital information relating to his sleeper cell contacts.",India,3.1,130 min
Ghanchakkar,2013,"Comedy, Crime, Thriller",N/A,tt2246724,Raj Kumar Gupta,Raj Kumar Gupta,"Emraan Hashmi, Vidya Balan, Amar Kaushik",A safe cracker claims he has lost his memory when two criminals come calling for their cut of the bank heist loot.,India,5.9,137 min
Charmurti,1978,Comedy,Not Rated,tt2265207,Umanath Bhattacharya,Umanath Bhattacharya,"Chinmoy Roy, Krishna Saha, Shambhu Ganguly","Based on Narayan Gangopadhyay‚Äôs creation, Potoldangar Charmurti is the story of Tenida and his three followers, who go on a holiday and end up solving a mystery case.",India,7.7,112 min
Kung Fu Panda 3,2016,"Animation, Action, Adventure",PG,tt2267968,Jonathan Aibel,"Alessandro Carloni, Jennifer Yuh Nelson","Jack Black, Bryan Cranston, Dustin Hoffman","Continuing his ""legendary adventures of awesomeness"", Po must face two hugely epic, but different threats: one supernatural and the other a little closer to home.","China, United States",7.1,95 min
Satyagraha,2013,Drama,N/A,tt2275802,Prakash Jha,Prakash Jha,"Kareena Kapoor, Amitabh Bachchan, Ajay Devgn",A corporate go-getter sees his priorities shift when a personal tragedy brings him face-to-face with political corruption.,India,5.9,152 min
Kamaal Dhamaal Malamaal,2012,"Comedy, Drama",N/A,tt2278422,N/A,Priyadarshan,"Nana Patekar, Shreyas Talpade, Om Puri","Jhonny is often fooled by villagers as he is fit for nothing. He is in love with Maria but is often targeted by her brothers. Then enters Sam, who will be like a Samaritain to Jhonny's family.",India,4.2,148 min
OMG: Oh My God!,2012,"Comedy, Drama, Fantasy",Not Rated,tt2283748,Alok Jha,Umesh Shukla,"Paresh Rawal, Akshay Kumar, Mithun Chakraborty",A shopkeeper takes God to court when his shop is destroyed by an earthquake.,India,8.1,125 min
Chakravyuh,2012,"Action, Drama, Thriller",Not Rated,tt2292625,Prakash Jha,Prakash Jha,"Manoj Bajpayee, Kabir Bedi, Om Puri","On the request of his friend Kabir, SP Adil Sends him to the Naxal group as an informer. When Kabir finds the truth he becomes one of their gang leader.",India,6.8,152 min
Minions,2015,"Animation, Adventure, Comedy",PG,tt2293640,Brian Lynch,"Kyle Balda, Pierre Coffin","Sandra Bullock, Jon Hamm, Michael Keaton","Minions Stuart, Kevin, and Bob are recruited by Scarlet Overkill, a supervillain who, alongside her inventor husband Herb, hatches a plot to take over the world.","United States, France",6.4,91 min
Frozen,2013,"Animation, Adventure, Comedy",PG,tt2294629,Jennifer Lee,"Chris Buck, Jennifer Lee","Kristen Bell, Idina Menzel, Jonathan Groff","When the newly crowned Queen Elsa accidentally uses her power to turn things into ice to curse her home in infinite winter, her sister Anna teams up with a mountain man, his playful reindeer, and a snowman to change the weather co...",United States,7.4,102 min
Shootout at Wadala,2013,"Action, Biography, Crime",Not Rated,tt2301155,Sanjay Bhatia,Sanjay Gupta,"Anil Kapoor, John Abraham, Manoj Bajpayee","Based on the true story of the first-ever registered encounter by the Mumbai Police, which took place on November 1, 1982.",India,6,155 min
Ishaqzaade,2012,"Action, Drama, Romance",Not Rated,tt2308773,Aditya Chopra,Habib Faisal,"Arjun Kapoor, Parineeti Chopra, Gauahar Khan",A love story of a passion ignited by hatred. Of two people. Born to hate. Destined to love.,India,6.5,120 min
Singham Returns,2014,"Action, Crime, Drama",Not Rated,tt2309764,Rohit Shetty,Rohit Shetty,"Ajay Devgn, Kareena Kapoor, Amole Gupte","Owing to the wrongdoings affiliated with evils similar to black money, an honest but ferocious police officer returns as the Deputy Commissioner of Police with the prospect of wiping out injustice.",India,5.7,142 min
Koyekti Meyer Golpo,2012,"Crime, Drama",N/A,tt2310964,Subrata Sen,Subrata Sen,"Tanushree Chakraborty, Locket Chatterjee, Nimisha de Sarkar","A weird take on adventures of sophisticated escort-service females based in Kolkata (Calcutta), India. A non-narrative story, exploring the fun aspect of sexuality of young females. An Independent film, showcasing a few incidents ...",India,4.2,117 min
Qissa: The Tale of a Lonely Ghost,2013,"Drama, Fantasy, Horror",N/A,tt2334779,Anup Singh,Anup Singh,"Irrfan Khan, Tisca Chopra, Tillotama Shome","Umber Singh is a Sikh who loses everything during the separation of India in 1947 and is forced to leave his homeland. He obsessively wishes for a male heir. When his fourth daughter is born, he decides to wage a fight against des...","Germany, India, Netherlands, France",6.7,109 min
PK,2014,"Comedy, Drama, Sci-Fi",Not Rated,tt2338151,Rajkumar Hirani,Rajkumar Hirani,"Aamir Khan, Anushka Sharma, Sanjay Dutt",An alien on Earth loses the only device he can use to communicate with his spaceship. His innocent nature and child-like questions force the country to evaluate the impact of there religious views on there people.,India,8.1,153 min
The Lunchbox,2013,"Drama, Romance",PG,tt2350496,Ritesh Batra,Ritesh Batra,"Irrfan Khan, Nimrat Kaur, Nawazuddin Siddiqui",A mistaken delivery in Mumbai's famously efficient lunchbox delivery system connects a young housewife to an older man in the dusk of his life as they build a fantasy world together through notes in the lunchbox.,"India, France, Germany, United States, Canada",7.8,104 min
Teri Meri Kahaani,2012,"Comedy, Drama, Romance",Not Rated,tt2354407,Surabhi Bhatnagar,Kunal Kohli,"Shahid Kapoor, Priyanka Chopra Jonas, Prachi Desai","The true love between a couple in 1910, 1960 and 2012. Their love is so strong that even destiny wants to bring them together.",India,4.9,117 min
Bhaag Milkha Bhaag,2013,"Biography, Drama, Sport",Not Rated,tt2356180,Prasoon Joshi,Rakeysh Omprakash Mehra,"Farhan Akhtar, Deepak Singh Rawat, Japtej Singh","The truth behind the ascension of Milkha Singh, who was scarred by of the India-Pakistan partition.",India,8.2,186 min
Ramaiya Vastavaiya,2013,"Action, Drama, Romance",N/A,tt2357926,Shiraz Ahmed,Prabhu Deva,"Shruti Haasan, Girish Taurani, Sonu Sood","Ram falls in love with Sona, who lives on the fields of Punjab. He follows her to her farm, where her elder brother challenges him to produce more seed on their fields. If he wins, he will be allowed to marry her.",India,5.7,148 min
Raanjhanaa,2013,"Drama, Romance",Not Rated,tt2359810,John Mahendran,Aanand L. Rai,"Dhanush, Sonam Kapoor, Mohd. Zeeshan Ayyub","Kundan, the son of a Hindu pundit, discovers that his childhood sweetheart Zoya loves city-bred Akram and wants to marry him. However, he persistently seeks to win her heart.",India,7.6,140 min
Laptop,2012,Drama,N/A,tt2363255,Kaushik Ganguly,Kaushik Ganguly,"Aparajita Adhya, Anjana Basu, Rahul Bose","People in primitive times connected through people. And then there was a time when people wrote letters to connect, and letters took long to arrive. With advancement in technology, snail mail has taken a backseat, and connecting w...",India,7,120 min
2 States,2014,"Comedy, Drama, Romance",Not Rated,tt2372678,Chetan Bhagat,Abhishek Varman,"Arjun Kapoor, Alia Bhatt, Amrita Singh",This movie chronicles how Chetan met his wife and the difficulties they faced due to their cultural differences.,India,6.9,149 min
Goraay Gandogol,2012,Comedy,N/A,tt2375091,Aniket Chattopadhyay,Aniket Chattopadhyay,"Rahul Banerjee, Sampurna Lahiri, Rajatabha Dutta","A boy mistakenly reveals falseness about his family to the in-laws, so he must get some people to act as his relatives.",India,6.8,147 min
Special 26,2013,"Crime, Drama, Thriller",Not Rated,tt2377938,Neeraj Pandey,Neeraj Pandey,"Akshay Kumar, Anupam Kher, Manoj Bajpayee",A gang of con-men rob prominent rich businessmen and politicians by posing as C.B.I and income tax officers.,India,8,144 min
Top Gun,1986,"Action, Drama",PG,tt0092099,Jim Cash,Tony Scott,"Tom Cruise, Tim Robbins, Kelly McGillis","As students at the United States Navy's elite fighter weapons school compete to be best in the class, one daring young pilot learns a few things from a civilian instructor that are not taught in the classroom.",United States,6.9,109 min
Nymphomaniac: Vol. II,2013,Drama,Not Rated,tt2382009,Lars von Trier,Lars von Trier,"Charlotte Gainsbourg, Stellan Skarsg√•rd, Willem Dafoe","The continuation of Joe's sexually dictated life delves into the darker aspects of her adulthood, obsessions and what led to her being in Seligman's care.","Denmark, Germany, Belgium, United Kingdom, France, Sweden",6.6,124 min
D-Day,2013,"Action, Thriller",Not Rated,tt2385104,Nikkhil Advani,Nikkhil Advani,"Irrfan Khan, Rishi Kapoor, Arjun Rampal",A team of experts dispatched to bring in The Most Wanted Man in India almost achieve the unthinkable ... until something goes horribly wrong.,India,7.2,153 min
How to Train Your Dragon: The Hidden World,2019,"Animation, Action, Adventure",PG,tt2386490,Dean DeBlois,Dean DeBlois,"Jay Baruchel, America Ferrera, F. Murray Abraham","When Hiccup discovers Toothless isn't the only Night Fury, he must seek ""The Hidden World"", a secret Dragon Utopia before a hired tyrant named Grimmel finds it first.","United States, Japan",7.4,104 min
Ungli,2014,"Crime, Drama, Thriller",Not Rated,tt2392447,Renzil D'Silva,Renzil D'Silva,"Sanjay Dutt, Emraan Hashmi, Kangana Ranaut",A gang of friends decide to take justice into their own hands.,India,5.9,114 min
