Movie,Year,Genres,Certification/Rating,IMDb ID,Writer,Director,Actors,Plot,Country,IMDb Rating,Runtime
Pyaar Ka Punchnama 2,2015,"Comedy, Drama, Romance",Not Rated,tt4430136,Luv Ranjan,Luv Ranjan,"Kartik Aaryan, Omkar Kapoor, Sunny Singh","After falling in love, three roommates experience changes in their lives.",India,7.3,137 min
Drishyam,2015,"Crime, Drama, Mystery",Not Rated,tt4430212,Jeethu Joseph,Nishikant Kamat,"Ajay Devgn, Shriya Saran, Tabu","Desperate measures are taken by a man who tries to save his family from the dark side of the law, after they commit an unexpected crime.",India,8.2,163 min
Captain Vyom,1998‚Äì1999,"Action, Sci-Fi",N/A,tt4631018,N/A,N/A,"Kartika Rane, Milind Soman, Shehzaad Saeed",A superhero Captain Vyom is given a team of some exceptionally-powered soldiers to fight 12 great villains of all-time who escaped the prison located on a moon of Jupiter.,India,8.4,24 min
Masaan,2015,Drama,N/A,tt4635372,Akbar Allahabadi,Neeraj Ghaywan,"Richa Chadha, Sanjay Mishra, Vicky Kaushal","Along India's Ganges River, four people face prejudice, a strict moral code and a punishing caste system as they confront personal tragedies.","India, France",8.1,109 min
Belaseshe,2015,"Drama, Family",N/A,tt4658770,Shiboprosad Mukherjee,"Shiboprosad Mukherjee, Nandita Roy, Jyoti Hazra","Soumitra Chatterjee, Swatilekha Sengupta, Rituparna Sengupta","A story of relationships that explores the intricacies of the married life, of life-long companionship, of promises and expectations and love.",India,8.5,141 min
Kadambari,2015,"Drama, History",Not Rated,tt4658786,Suman Ghosh,Suman Ghosh,"Konkona Sen Sharma, Parambrata Chattopadhyay, Kaushik Sen","Kadambari is based on the unique relationship between Rabindranath Tagore and his sister-in-law, Kadambari Devi. The film is a sensitive amalgamation of myth and reality structured in the form of a drama.",India,7,87 min
Great Grand Masti,2016,"Comedy, Drama, Fantasy",N/A,tt4675030,Tushar Hiranandani,Indra Kumar,"Urvashi Rautela, Riteish Deshmukh, Vivek Oberoi","Amar, Meet and Prem go into a small town where they encounter a 'femme fatale' in the form of Ragini. Ragini is everything they had dreamed of, but she slowly turns into their worst nightmare!",India,3.7,134 min
Ki & Ka,2016,"Comedy, Romance",Not Rated,tt4744086,R. Balki,R. Balki,"Amitabh Bachchan, Kareena Kapoor, Arjun Kapoor","Follows a young, married couple whose relationship challenges the gender roles placed upon women and men in Indian society.",India,5.7,126 min
War Machine,2017,"Comedy, Drama, War",TV-MA,tt4758646,Michael Hastings,David Mich√¥d,"Brad Pitt, Daniel Betts, John Magaro","An idiosyncratic general confronts opposition from enemies, allies, and bureaucrats while leading a massive rebuilding operation in Afghanistan.",United States,6,122 min
Sultan,2016,"Action, Drama, Romance",Not Rated,tt4832640,Ali Abbas Zafar,Ali Abbas Zafar,"Salman Khan, Anushka Sharma, Randeep Hooda","Sultan is a classic underdog tale about a wrestler's journey, looking for a comeback by defeating all odds.",India,7,170 min
Baahubali 2: The Conclusion,2017,"Action, Drama",Not Rated,tt4849438,Vijayendra Prasad,S.S. Rajamouli,"Prabhas, Rana Daggubati, Anushka Shetty","Amarendra Baahubali, the heir apparent to the throne of Mahishmati, finds his life and relationships endangered as his adoptive brother Bhallaladeva conspires to claim the throne.",India,8.2,167 min
Hate Story 3,2015,"Drama, Thriller",Not Rated,tt4865436,Vikram Bhatt,Vishal Pandya,"Sharman Joshi, Karan Singh Grover, Zareen Khan",Siya appears to be the bone of contention between warring businessmen Aditya and Saurav. But this one runs deeper than your average love triangle.,India,4.6,126 min
Neon Bull,2015,Drama,Unrated,tt4899406,Marcelo Gomes,Gabriel Mascaro,"Juliano Cazarr√©, Maeve Jinkings, Josinaldo Alves","Iremar works at the rodeo in North East of Brazil. From his home, the truck used to transport the animals, he dreams of a future in the region's booming clothing industry.","Brazil, Uruguay, Netherlands",6.8,101 min
Kapoor & Sons,2016,"Comedy, Drama, Family",Not Rated,tt4900716,Shakun Batra,Shakun Batra,"Rishi Kapoor, Rajat Kapoor, Ratna Pathak Shah",The story about two brothers who visit their dysfunctional family for their grandfather's birthday party.,India,7.7,132 min
Azhar,2016,"Biography, Drama, Sport",Not Rated,tt4906984,Rajat Arora,Anthony D'Souza,"Emraan Hashmi, Nargis Fakhri, Prachi Desai","Biographical sports drama based on the life of former Indian international cricketer, Mohammad Azharuddin",India,5.7,130 min
Uro Chithi,2011,Drama,N/A,tt5009100,Anindya Chatterjee,Kamaleswar Mukherjee,"Biswanath Basu, Biswajit Chakraborty, Sudipta Chakraborty",Sorting through a backlog of email proves nostalgic and illuminating for a young alcoholic.,India,5.9,130 min
Befikre,2016,"Comedy, Drama, Romance",Not Rated,tt5108476,Aditya Chopra,"Aditya Chopra, Raj Basu","Ranveer Singh, Vaani Kapoor, Ayesha Raza Mishra","It is a carefree love story of Dharam and Shyra, who find love in an engaging series of experiences. Doused in the spirit of Paris, it celebrates a sensual and free-spirited love.",India,4.1,130 min
Force 2,2016,"Action, Adventure, Thriller",Not Rated,tt5156746,Jasmeet K Reen,Abhinay Deo,"John Abraham, Sonakshi Sinha, Tahir Raj Bhasin",ACP Yashvardhan teams up with RAW Agent KK to bring down the mole within RAW.,India,6.2,127 min
Rustom,2016,"Crime, Drama, Thriller",Not Rated,tt5165344,Vipul K. Rawal,Tinu Suresh Desai,"Akshay Kumar, Ileana D'Cruz, Arjan Bajwa","A naval officer returns home to find out about his wife's affair. Soon, he surrenders after murdering the lover but as the case unfolds, it starts to reveal his hidden intention.",India,7,148 min
Baar Baar Dekho,2016,"Action, Comedy, Drama",Not Rated,tt5197544,Sri Rao,Nitya Mehra,"Sidharth Malhotra, Katrina Kaif, Sayani Gupta",The highs and lows of a romantic relationship are examined through flashbacks and flash-forwards.,India,5.4,141 min
Around the Sun,2019,Drama,N/A,tt5219958,Jonathan Kiefer,Oliver Krimpas,"Cara Theobold, Gethin Anthony","Touring a repossessed chateau, a film location scout falls for its flirtatious representative, who recounts the story of an influential book written there. But is their connection for real, or just a projection of the book's chara...",United Kingdom,5.6,78 min
Namte Namte,2013,Drama,N/A,tt5281646,Rana Dasgupta,Rana Basu,"Bhaswar Chatterjee, Saswata Chatterjee, Rajatabha Dutta","Ananda, a peace-loving person, lives with his wife Seema and daughter Dolon. Things turn upside down when he seeks help from a small-time criminal to get rid of his daily tribulations.",India,6.2,124 min
Katakuti,2011,"Drama, Family",Not Rated,tt5282110,Premangshu Roy,Premangshu Roy,"Dwijen Banerjee, Rahul Banerjee, Biswajit Chakraborty",N/A,India,4.8,121 min
8:08 Er Bongaon Local,2012,Drama,N/A,tt5470672,Padmanabha Dasgupta,Debaditya Bandyopadhyay,"Bhaskar Banerjee, Haradhan Bannerjee, Barun Chakraborty",Ananta Das is a normal middle class man like any other. Every day he avails the 8:08 A.M Bongaon Local to Kolkata to attain his office. Some known and unknown common people are his companions throughout his journey every day. He h...,India,N/A,125 min
Meri Pyaari Bindu,2017,"Comedy, Drama, Romance",Not Rated,tt5472374,Soumik Sen,Akshay Roy,"Ayushmann Khurrana, Parineeti Chopra, Nishant Dahiya","Abhimanyu Roy returns to his roots to write an old-fashioned love story, 3 years in the making. This writer's block is called Bindu. How do you contain this live wire in a book?",India,6,117 min
Swade Ahlade,2015,Drama,N/A,tt5482998,N/A,Arindam Sil,"Biswanath Basu, Biswajit Chakraborty, Nina Chakraborty","Life at 40, for the quiet natured Chaitali, starts becoming meaningless. In a family of a scheming mother-in-law, a formidable father-in-law and a non-attention giving husband, Chaitali begins questioning her self-worth. However, ...",India,6.8,130 min
Pink,2016,"Crime, Drama, Thriller",Not Rated,tt5571734,Shoojit Sircar,Aniruddha Roy Chowdhury,"Amitabh Bachchan, Taapsee Pannu, Kirti Kulhari","When three young women are implicated in a crime, a retired lawyer steps forward to help them clear their names.",India,8.1,136 min
A Gentleman,2017,"Action, Comedy",Not Rated,tt5613834,Raj Nidimoru,"Krishna D.K., Raj Nidimoru","Sidharth Malhotra, Jacqueline Fernandez, Darshan Kumaar","Gaurav, a simple hard working guy for a white collar job visits Mumbai for a meeting where his doppelganger is about to bring chaos in his life.",India,6.2,145 min
Madaari,2016,"Drama, Thriller",Not Rated,tt5713232,Shailja Kejriwal,Nishikant Kamat,"Irrfan Khan, Jimmy Shergill, Vishesh Bansal","When Nirmal loses his family in a disaster caused by government corruption, he embarks on a journey seeking accountability and revenge.",India,7.6,133 min
OK Jaanu,2017,"Drama, Romance",Not Rated,tt5764024,Mani Ratnam,Shaad Ali,"Aditya Roy Kapoor, Shraddha Kapoor, Naseeruddin Shah","Adi and Tara move to Mumbai to pursue their dreams. A chance meeting sparks off a heady, no strings attached romance until their careers pull them apart. Will ambition prevail over matters of the heart?",India,5.2,135 min
Veere Di Wedding,2018,Comedy,N/A,tt5842616,Nidhi Mehra,Shashanka Ghosh,"Kareena Kapoor, Sonam Kapoor, Swara Bhasker",Four girls on their way to find true love discover that their friendship must remain strong until the wedding of a friend named Veer.,India,3.3,135 min
Dear Zindagi,2016,"Drama, Romance",Not Rated,tt5946128,Krishnan Hariharan,Gauri Shinde,"Alia Bhatt, Shah Rukh Khan, Kunal Kapoor","Kaira is a budding cinematographer in search of a perfect life. Her encounter with Jug, an unconventional thinker, helps her gain a new perspective on life. She discovers that happiness is all about finding comfort in life's imper...",India,7.4,151 min
Jolly LLB 2,2017,"Comedy, Crime, Drama",Not Rated,tt5982852,Subhash Kapoor,Subhash Kapoor,"Akshay Kumar, Huma Qureshi, Saurabh Shukla",Jolly is a clumsy lawyer who is faced with representing the most critical court case of his career.,India,7.2,137 min
Naam Shabana,2017,"Action, Drama, Thriller",Not Rated,tt6170954,Neeraj Pandey,Shivam Nair,"Taapsee Pannu, Akshay Kumar, Manoj Bajpayee","This Spin-off from Baby (2015) provides the back-story of intelligence agent Shabana, and chronicles how she becomes a spy.",India,6.2,147 min
Brahmastra Part One: Shiva,2022,"Action, Adventure, Fantasy",Not Rated,tt6277462,Hussain Dalal,Ayan Mukerji,"Amitabh Bachchan, Ranbir Kapoor, Alia Bhatt","A DJ with superpowers and his ladylove embark on a mission to protect the Brahmastra, a weapon of enormous energy, from dark forces closing in on them.",India,5.6,167 min
The Ghazi Attack,2017,"Action, Thriller, War",Not Rated,tt6299040,Sankalp Reddy,Sankalp Reddy,"Rana Daggubati, Kay Kay Menon, Atul Kulkarni","A Pakistani submarine, Ghazi plans to secretly attack Vizag port. For doing so, it has to get past Indian submarine S21.",India,7.5,116 min
Bhool Bhulaiyaa 2,2022,"Comedy, Drama, Horror",N/A,tt6455162,Aakash Kaushik,Anees Bazmee,"Tabu, Kartik Aaryan, Kiara Advani","When strangers Reet and Ruhan cross paths, their journey leads to an abandoned mansion and a dreaded spirit that has been trapped for 18 years.",India,5.7,143 min
Behen Hogi Teri,2017,Comedy,N/A,tt6537508,Sanchit Gupta,"Ajay Pannalal, Arvind Singh Rajpoot","Rajkummar Rao, Shruti Haasan, Gautam Gulati",A jobless youngster has to fight with criminal rivals who come to snatch away his neighborhood lady love as a bride and also his family which seems not to take note of his feelings towards the girl next door.,India,5.6,128 min
Hichki,2018,"Comedy, Drama",Not Rated,tt6588966,Anckur Chaudhry,Malhotra P. Siddharth,"Rani Mukerji, Naisha Khanna, Hussain Dalal","Suffering from Tourette Syndrome, Naina gets assigned a class of defiant students and must ensure that her students realise their potential.",India,7.5,116 min
Parmanu: The Story of Pokhran,2018,"Action, Drama, History",Not Rated,tt6826438,Saiwyn Quadras,Abhishek Sharma,"John Abraham, Boman Irani, Diana Penty","Ashwat Raina and his teammates arrive in Pokhran to re-conduct a confidential nuclear test, where they face challenges from the American Lacrosse satellite and local spies.",India,7.6,129 min
Bose: Dead/Alive,2017,"Biography, History, Mystery",TV-MA,tt6883044,Ekalavya Bhattacharya,N/A,"Rajkummar Rao, Naveen Kasturia, Edward Sonnenblick","The man. The legend. The mystery. He fascinated us in life, and long after his ""death"". This is the story of India's biggest cover-up: Netaji Subhash Chandra Bose and the mystery of his alleged death.",India,8.7,20 min
Kedarnath,2018,"Drama, Romance",Not Rated,tt7027278,Abhishek Kapoor,Abhishek Kapoor,"Sushant Singh Rajput, Sara Ali Khan, Nitish Bharadwaj","Mansoor, a reserved and reticent Pithoo, helps pilgrims make an arduous journey upwards to the temple town. His world turns around when he meets the beautiful and rebellious Mukku who draws him into a whirlwind of intense love.",India,6.7,116 min
No Doubt,2019,"Comedy, Romance",N/A,tt7368186,Clarence Williams IV,Clarence Williams IV,"Tara Kaye Burgh, Adam Stern-Rand, Marquis Wood",Two millennials connect on an online dating site and decide to spend an evening together.,United States,5.2,71 min
One Day We'll Tell Each Other Everything,2023,"Drama, History, Romance",N/A,tt21654390,Emily Atef,Emily Atef,"Marlene Burow, Felix Kramer, Cedric Eich","Set in a warm summer in 1990 in former East Germany, it follows a young woman who begins a relationship with a charismatic farmer who is twice her age.",Germany,6.1,129 min
Barood,2015,Action,N/A,tt7243728,Padmanabha Dasgupta,Soumik Haldar,"Mainak Banerjee, Nina Chakraborty, Ritabhari Chakraborty, Koushik Kar","Barood is a story of today's youngsters being exploited by corruption. Jui, an innocent girl, falls in love with a loafer Shaon. And this turns Shaon's life upside down. The lovebirds wish ...",India,N/A,N/A
War,2019,"Action, Adventure, Thriller",Not Rated,tt7430722,Siddharth Anand,Siddharth Anand,"Hrithik Roshan, Tiger Shroff, Vaani Kapoor","Indian agent Khalid goes on a mission to hunt and eliminate his former mentor, the country's top agent Kabir who has gone rogue. A deadly war begins.",India,6.5,151 min
JL50,2020,"Drama, Sci-Fi, Thriller",N/A,tt7441984,Shailender Vyas,N/A,"Abhay Deol, Pankaj Kapur, Ritika Anand","A plane is discovered to have recently crashed in West Bengal. However, what is so baffling about the incident is that plane originally went missing 35 years ago.",India,7.4,1 min
Rogue Agent,2022,"Drama, Thriller",N/A,tt9731386,Michael Bronner,"Declan Lawn, Adam Patterson","James Norton, Matthew Douglas, Rob Malone","The extraordinary and chilling story of career conman Robert Freegard who masqueraded as an MI5 agent and fooled people into going into hiding, and the woman who fell for him, and then brought him down.","United Kingdom, Germany, United States",6.4,115 min
Tanhaji: The Unsung Warrior,2020,"Action, Biography, Drama",Not Rated,tt8108274,Prakash Kapadia,Om Raut,"Ajay Devgn, Saif Ali Khan, Sharad Kelkar","Tanhaji Malusare, a military chieftain in the army of the Maratha king Shivaji, leads the charge to capture the strategically important Kondhana fort guarded by the army of the fierce Rajput chieftain Udaybhan Rathod.",India,7.5,135 min
Panipat,2019,"Action, Drama, History",Not Rated,tt8176040,Ranjeet Bahadur,Ashutosh Gowariker,"Arjun Kapoor, Sanjay Dutt, Kriti Sanon","The Great Betrayal is a War Epic set in 1761, when Sadashiv Rao Bhau Peshwa led the Maratha army to the north of India to repel the invading forces of Ahmad Shah Abdali, the King of Afghanistan.",India,5.2,171 min
Uri: The Surgical Strike,2019,"Action, Drama, History",Not Rated,tt8291224,Aditya Dhar,Aditya Dhar,"Vicky Kaushal, Paresh Rawal, Mohit Raina","Indian army special forces execute a covert operation, avenging the killing of fellow army men at their base by a terrorist group.",India,8.2,138 min
Jalebi,2018,"Drama, Romance",Not Rated,tt8426854,Pushpdeep Bhardwaj,"Pushpdeep Bhardwaj, Lal Mohan","Rhea Chakraborty, Varun Mitra, Digangana Suryavanshi",A woman boards an overnight train and gets placed in a compartment with her former lover and his wife.,India,6,112 min
Bidai Byomkesh,2018,Drama,N/A,tt8427166,Rohini Ghosh,Debaloy Bhattacharya,"Rupankar Bagchi, Rahul Banerjee, Bidipta Chakraborty","An aged Byomkesh Bakshi and a tale of his family. After 2 years of exile, one night 'Khoka' A.K.A Abhimanyu Bakshi surrenders in a police station declaring a murder. His son Satyaki initially accepts that fact but after his grandf...",India,5.2,121 min
Take me Somewhere Nice,2019,Drama,N/A,tt8567342,Ena Sendijarevic,Ena Sendijarevic,"Sara Luna Zoric, Lazar Dragojevic, Ernad Prnjavorac","On the edge of adulthood, Alma leaves her mother's home in the Netherlands and travels to her native Bosnia to visit the father she's never met. But from the start, nothing goes as planned.","Netherlands, Bosnia and Herzegovina",6.3,91 min
Ambar Sen Antordhan Rahasyo,1999,"Adventure, Crime, Thriller",N/A,tt8690662,Satyajit Ray,Sandip Ray,"Chitrabhanu Basu, Bibhu Bhattacharya, Sabyasachi Chakrabarty","Ambar Sen a well educated, intelligent man with a good depth of knowledge on different subjects came to Feluda for a case and gave him a letter on which someone or any group threatened Amber babu a few days ago. The very next day ...",India,6,49 min
Ghurghutiyar Ghotona,1998,Mystery,N/A,tt9004906,N/A,N/A,"Sabyasachi Chakrabarty, Saswata Chatterjee, Amar Gangopadhyay","Felua and Topshe are invited to the house of Kalikinkar Mukherjee, who wants them to unlock a locker combination uttered by his parrot. Feluda finds that out, in addition he finds out something more- a murder.",India,7.3,N/A
Jahangirer Swarnamudra,1998,"Adventure, Crime, Mystery",N/A,tt9034728,Satyajit Ray,Sandip Ray,"Dwijen Banerjee, Bibhu Bhattacharya, Sabyasachi Chakrabarty","A businessman invites his business partner, classmate and a friend on his 50th birthday. After dinner while the man showing some priceless coins of Jahangir, electricity goes off and later that day the man confirms one of his coin...",India,7.3,N/A
Chhichhore,2019,"Comedy, Drama, Romance",Not Rated,tt9052870,Piyush Gupta,Nitesh Tiwari,"Sushant Singh Rajput, Shraddha Kapoor, Varun Sharma","A tragic incident forces Anirudh, a middle-aged man, to take a trip down memory lane and reminisce his college days along with his friends, who were labelled as losers.",India,8.3,143 min
Mission Mangal,2019,"Drama, History",Not Rated,tt9248972,R. Balki,Jagan Shakti,"Akshay Kumar, Vidya Balan, Taapsee Pannu","Based on true events of the Indian Space Research Organisation (ISRO) successfully launching the Mars Orbiter Mission (Mangalyaan), making it the least expensive mission to Mars.",India,6.5,130 min
Angela,2023,"Biography, Crime, Drama",N/A,tt28118695,Duda de Almeida,Hugo Prata,"Isis Valverde, Gabriel Braga Nunes, Alice Carvalho","After a turbulent separation and having to give up custody of her three children, the famous socialite √Çngela Diniz meets Raul, and believes she has found someone who loves her free spirit as much as she does.",Brazil,N/A,104 min
Meet Cute,2022,"Comedy, Drama, Fantasy",TV-MA,tt14900738,Noga Pnueli,Alex Lehmann,"Kaley Cuoco, Pete Davidson, Kevin Corrigan","What would you do if you could travel to your loved ones' past, heal their traumas, fix their problems, and change them into the perfect partner?",United States,5.7,89 min
Hawa,2022,"Drama, Mystery",N/A,tt10928202,Mejbaur Rahman Sumon,Mejbaur Rahman Sumon,"Chanchal Chowdhury, Nazifa Tushi, Nasir Uddin Khan",Miracles about the life story of fishermen.,"Bangladesh, France",7.7,131 min
Animal,2023,"Action, Crime, Drama",N/A,tt13751694,Suresh Bandaru,Sandeep Reddy Vanga,"Ranbir Kapoor, Anil Kapoor, Bobby Deol","A father, who is often away due to work, is unable to comprehend the intensity of his son's fervent love and admiration, which creates conflict between both of them.",India,6.8,204 min
Durgeshgorer Guptodhon,2019,"Adventure, Comedy, Drama",N/A,tt9537068,Subhendu Dasmunshi,Dhrubo Banerjee,"Abir Chatterjee, Arjun Chakrabarty, Ishaa Saha",The adventurous trip of Abir and Jhinuk takes them to the legendary Durgeshgor.,India,6.7,133 min
…corchÈs,2005,"Crime, Thriller",N/A,tt0410557,Cheyenne Carron,Cheyenne Carron,"Vincent Martinez, M√©lanie Thierry, Fr√©d√©ric Saurel","A young couple set out for the quiet of a country house. During their stay, hidden from other people's gazes, they slip into a violent and passionate relationship that will drive them to commit a dreadful act.",France,5.3,77 min
Forbidden Love,2020,Romance,N/A,tt13026912,N/A,N/A,"Pooja Kumar, Ali Fazal, Patralekhaa Paul","A housewife's affair with a free-spirited man unleashes jealousy and betrayal, trapping her in a web of deceit that threatens her marriage.",India,5.4,N/A
Guptodhoner Sondhane,2018,Adventure,Not Rated,tt8374266,Rohini Ghosh,Dhrubo Banerjee,"Abir Chatterjee, Arjun Chakrabarty, Ishaa Saha",Abir and his companions visit his ancestral mansion only to find that his dead uncle has left behind a series of clues for him to unearth the hidden treasure of Mughal prince Shah Shuja kept secured within the property.,India,6.8,130 min
The Story of Marie and Julien,2003,"Drama, Fantasy, Mystery",Not Rated,tt0339357,Pascal Bonitzer,Jacques Rivette,"Emmanuelle B√©art, Jerzy Radziwilowicz, Anne Brochet","Middle-aged Julien lives alone with his cat. He dreams of Marie, and a few minutes later, he sees her on the street and makes a date. He asks her to move in with him, and she does. Her boyfriend is dead, the rest of her past a mys...","France, Italy",6.8,150 min
Jan Dara: The Beginning,2012,"Drama, Romance",N/A,tt2599106,Utsana Phleungtham,M.L. Pundhevanop Dhewakul,"Mario Maurer, Chaiyapol Jullian Poupart, Sakrat Ruekthamrong","Set in the 1930s the story of Jan, a boy who grows up in a house lorded over by his sadistic and debauched father, Luang Wisnan. The story recounts the growing pains of Jan, whose mother dies while giving birth to him and who's in...",Thailand,5.7,137 min
Jan Dara: The Finale,2013,Drama,N/A,tt2670454,Utsana Phleungtham,M.L. Pundhevanop Dhewakul,"Mario Maurer, Chaiyapol Jullian Poupart, Sakrat Ruekthamrong","Jan Dara returns to Bangkok to take revenge against the man who has made his life a living hell. The fire of vengeance consumes him so much, that he's becoming the man he hated all his life. He wants to see those who wronged him s...",Thailand,5.5,138 min
Karnasubarner Guptodhon,2022,"Adventure, Mystery, Thriller",N/A,tt22336444,Dhrubo Banerjee,Dhrubo Banerjee,"Abir Chatterjee, Arjun Chakrabarty, Ishaa Saha","Sona Da, Abir and Jhinuk come across a riddle that turns their vacation into a dangerous quest for the hidden treasure of King Shashanka, one of the best-kept secrets of Bengal.",India,6,128 min
L'enfer,2005,Drama,N/A,tt0430224,Krzysztof Kieslowski,Danis Tanovic,"Emmanuelle B√©art, Karin Viard, Marie Gillain",Three sisters share a connection to a violent incident from their childhood reunite to for the chance to come to terms with their past.,"France, Italy, Belgium, Japan",6.8,102 min
Only You,2018,"Drama, Romance",Not Rated,tt7531138,Harry Wootliff,Harry Wootliff,"Laia Costa, Stuart Martin, Lisa McGrillis","Elena and Jake meet by chance on New Years Eve, arguing for the same taxi. However, instead of going their separate ways after sharing a taxi, they initiate a determined relationship.","United Kingdom, Sweden",6.7,119 min
Palitan,2021,Drama,N/A,tt16392846,Honeylyn Joy Alipio,Brillante Mendoza,"Cara Gonzales, Jela Cuenca, Luis Hontiveros","When a dare pushes two couples into an orgy, suppressed feelings rekindle between the two ladies, who were once bestfriends and lovers.",Philippines,5.3,107 min
Rocket Boys,2022,"Drama, History",N/A,tt13868972,Nikkhil Advani,N/A,"Jim Sarbh, Saba Azad, Regina Cassandra","The story of two extraordinary men, Dr. Homi Jehangir Bhabha and Dr. Vikram Ambalal Sarabhai, who created history while building India's future.",India,8.9,3 min
Forever First Love,2020,"Drama, Romance",N/A,tt10485148,Luke Mayze,Luke Mayze,"Steven Rooke, Carlotta Morelli, Hugo Stinson","Paul is a photographer who runs into his first love, Anna in a busy Filipino market. The traveler's passions reignite, their principles on relationships, religion and morality clash. The night they spend together will change every...","Australia, Philippines",5.1,80 min
Sam Bahadur,2023,"Biography, Drama, War",N/A,tt10786774,Meghna Gulzar,Meghna Gulzar,"Vicky Kaushal, Sanya Malhotra, Fatima Sana Shaikh",Revolves around the high and low points of Sam Manekshaw who became the first Indian Army officer to be promoted to the rank of Field Marshal.,India,7.9,150 min
Special OPS,2020,"Action, Crime, Thriller",TV-MA,tt11854694,Neeraj Pandey,N/A,"Kay Kay Menon, Karan Tacker, Gautami Kapoor","The story through the eyes of Himmat Singh is based on the inspiration was taken from Nineteen Years of nationally significant events, several espionage missions were undertaken by India in the last two decades.",India,8.6,2 min
La Belle Noiseuse,1991,Drama,Unrated,tt0101428,Pascal Bonitzer,Jacques Rivette,"Michel Piccoli, Jane Birkin, Emmanuelle B√©art","The former famous painter Frenhofer revisits an abandoned project using the girlfriend of a young visiting artist. Questions about truth, life, and artistic limits are explored.","France, Switzerland",7.5,238 min
The Concubine,2012,"Drama, History, Romance",Unrated,tt2544120,Yoon-Jung Hwang,Dae-seung Kim,"Cho Yeo-jeong, Kim Dong-wook, Kim Min-joon","A tragic love triangle story between Hwa-Yeon, a daughter of a nobleman, her true love Kwon-Yoo, a servant and the man who will be King, Prince Sungwon.",South Korea,6.1,122 min
